{
  "schema": "inside-valdivia.rolling-plan/1",
  "id": "native-continuation-chain",
  "status": "offline-ready",
  "frame_rate": 24,
  "source_locks": {
    "cauce_commit": "5a3d3a23b79712ed07349079b8312da4cd3fe4de",
    "runtime_repository": "https://github.com/hypereikon-lab/ComfyUI-Runtime-Control",
    "runtime_commit": "6751b8fd90b02ef871bc046f228b83b004871d3a"
  },
  "execution": {
    "runtime_schema": "comfy.run-series/1",
    "requires_materialized_graphs": true,
    "auto_wire_outputs": false,
    "binding_mode": "explicit-prebound"
  },
  "checkpoint_policy": {
    "frequency": "after-each-step",
    "immutability": "content-addressed",
    "receipt_required": true
  },
  "branch_policy": {
    "mode": "new-plan-from-checkpoint",
    "mutate_existing_plan": false,
    "rollback_operation": "rollback.native_av",
    "rollback_operation_version": 1,
    "rollback_operation_contract_hash": "e440ecd49654c0f21227593a69af5a009d879c73389bfe6b8c859d64d1d61a1c"
  },
  "steps": [
    {
      "id": "seed",
      "position": 1,
      "operation": "generate.keyframed",
      "operation_version": 2,
      "operation_contract_hash": "3d9f3d24a99ac78161ea7b7bd2c4e976795b94c37bc890613873bf70d9ce05df",
      "variant": "first-frame",
      "topology_key": "generate.keyframed@first-frame",
      "materialization_plan": "materialization/plans/01-keyframed-first-frame.json",
      "depends_on": null,
      "input_bindings": {
        "first_frame": null
      },
      "output_native_state": "native-av:branch-a:seed",
      "status": "offline-ready"
    },
    {
      "id": "extend-01",
      "position": 2,
      "operation": "continue.native_av",
      "operation_version": 3,
      "operation_contract_hash": "7990464810ab00136edadb5e3b5f624521fc70681c2fb4b803232ea5496be4cd",
      "variant": "keyframe-overlap",
      "topology_key": "continue.native_av@keyframe-overlap",
      "materialization_plan": "materialization/plans/07-native-continuation.json",
      "depends_on": "seed",
      "input_bindings": {
        "source_native_av_latent": {
          "from_step": "seed",
          "output_native_state": "native-av:branch-a:seed"
        },
        "source_timeline_origin": 0
      },
      "output_native_state": "native-av:branch-a:extend-01",
      "status": "offline-ready"
    },
    {
      "id": "extend-02",
      "position": 3,
      "operation": "continue.native_av",
      "operation_version": 3,
      "operation_contract_hash": "7990464810ab00136edadb5e3b5f624521fc70681c2fb4b803232ea5496be4cd",
      "variant": "masked-overlap",
      "topology_key": "continue.native_av@masked-overlap",
      "materialization_plan": "materialization/plans/14-continuation-masked-overlap.json",
      "depends_on": "extend-01",
      "input_bindings": {
        "source_native_av_latent": {
          "from_step": "extend-01",
          "output_native_state": "native-av:branch-a:extend-01"
        },
        "source_timeline_origin": 0
      },
      "output_native_state": "native-av:branch-a:extend-02",
      "status": "offline-ready"
    }
  ]
}
